{"artifactCatalogDigest":"ee22fff46166ac57e144905d1fe952c4195e4a33237f7b7dc3aaa4011f524a3f","artifacts":[{"digest":"c7366579ba423b42124abfb860ede43054e8ebab186951d0a0228c3965912b87","role":"program"},{"digest":"ed9ae3907d39b5d29809163ea7d272745a559504a408083b9edab6a9b5d267da","role":"pattern-source"},{"digest":"3a9db24b23b99a7a5a57e10fd4ef4591d553bc6bd1e6dc15fcceac9588b90dbd","role":"pattern-plan"},{"digest":"078960b20beff8c8d087be6163897925d85fe257c808ffdbac80662fc32ff88e","role":"pattern-query"}],"bounds":{"branches":8,"depth":20,"results":8,"timeMs":1000},"compatibilityProfileDigest":"ad82459e7c7ec47e806ba9731937624b520cae14cc5af6120c9d4ebf03db5e51","definitionDigest":"66e6071ca706036e1040f971b77629f80bd278ee5899c820d9065386555c0ca9","executionMode":"symbolic","executionProfileDigest":"e9b7845643b4942f1255e2fa3fd736eb28e60b9c402d6bdf67577142f7e009e9","expectedResultDigest":"84b584eeb5e633e64cbf2d94b70c3c0f7bfc36fed8376efde6290a8f06c906fe","invocationDigest":"ba4b5f2ae9424428fb849faa67bb8597b36109f375e620667af66016371bb7d5","kind":"pattern-query","observationManifestDigest":"b6d979bae0b1290d75c1ca4628da89e4443d88748f9f14d625a7c7b308053dd5","observerDigest":"485078d426d44f79b75a0c4dec20db00f625c8815a62e5a0c7e01e7ed8e06d52","optionsDigest":"537df92119f4cd64d786770fcea476b226048ccd01dde1cf71faec9433380e2c","packageVersion":"backend-agnostic-k-in-k-v1","parserDigest":"e2221c543e1c974746daee9fc9a309a1e62047902ede87768f4ffc0379e9e628","patternPlan":{"digest":"3a9db24b23b99a7a5a57e10fd4ef4591d553bc6bd1e6dc15fcceac9588b90dbd","role":"pattern-plan"},"patternQuery":{"digest":"078960b20beff8c8d087be6163897925d85fe257c808ffdbac80662fc32ff88e","role":"pattern-query"},"patternSource":{"digest":"ed9ae3907d39b5d29809163ea7d272745a559504a408083b9edab6a9b5d267da","role":"pattern-source"},"programDigest":"c7366579ba423b42124abfb860ede43054e8ebab186951d0a0228c3965912b87","queryId":"078960b20beff8c8d087be6163897925d85fe257c808ffdbac80662fc32ff88e","replayId":"dd2538f21c30da58b3c61104d225c4fc185b8def5dcfa84a8076ed12562fd15b","schemaVersion":1,"searchPolicy":"exhaustive","solverProfileDigest":"424a43a7080091bef7c7c3561a12ce50354e38318c0ccc856da04855fff71161","startSymbol":"Pgm","steps":[{"expectedArtifacts":[{"digest":"66e6071ca706036e1040f971b77629f80bd278ee5899c820d9065386555c0ca9","role":"definition"}],"inputArtifacts":[{"digest":"66e6071ca706036e1040f971b77629f80bd278ee5899c820d9065386555c0ca9","role":"definition"}],"optionsDigest":"537df92119f4cd64d786770fcea476b226048ccd01dde1cf71faec9433380e2c","ordinal":0,"role":"ingest"},{"expectedArtifacts":[{"digest":"66e6071ca706036e1040f971b77629f80bd278ee5899c820d9065386555c0ca9","role":"instrumented-definition"}],"inputArtifacts":[{"digest":"66e6071ca706036e1040f971b77629f80bd278ee5899c820d9065386555c0ca9","role":"definition"},{"digest":"f519dccd7c69585cb2b01dc6bce160ce1c4da617eeb5e575c0567e4fd07f5b62","role":"transformation"}],"optionsDigest":"537df92119f4cd64d786770fcea476b226048ccd01dde1cf71faec9433380e2c","ordinal":1,"role":"transform"},{"expectedArtifacts":[{"digest":"a50930568e497c536fdeaa264e1fbd736cb2e630ce7eb36ac1ee086c04505fdb","role":"event-trace"}],"inputArtifacts":[{"digest":"66e6071ca706036e1040f971b77629f80bd278ee5899c820d9065386555c0ca9","role":"instrumented-definition"},{"digest":"c7366579ba423b42124abfb860ede43054e8ebab186951d0a0228c3965912b87","role":"program"}],"optionsDigest":"537df92119f4cd64d786770fcea476b226048ccd01dde1cf71faec9433380e2c","ordinal":2,"role":"execute"},{"expectedArtifacts":[{"digest":"84b584eeb5e633e64cbf2d94b70c3c0f7bfc36fed8376efde6290a8f06c906fe","role":"pattern-result"}],"inputArtifacts":[{"digest":"0a9c0bc96c44bc85d720f2e57eeefdac3f1989923ab44871be141d7a0fd910f8","role":"event-trace"},{"digest":"ed9ae3907d39b5d29809163ea7d272745a559504a408083b9edab6a9b5d267da","role":"pattern-source"},{"digest":"3a9db24b23b99a7a5a57e10fd4ef4591d553bc6bd1e6dc15fcceac9588b90dbd","role":"pattern-plan"},{"digest":"078960b20beff8c8d087be6163897925d85fe257c808ffdbac80662fc32ff88e","role":"pattern-query"}],"optionsDigest":"537df92119f4cd64d786770fcea476b226048ccd01dde1cf71faec9433380e2c","ordinal":3,"role":"match"}],"testId":"write-only","transformationDigests":["f519dccd7c69585cb2b01dc6bce160ce1c4da617eeb5e575c0567e4fd07f5b62"]}